<?xml version="1.0" encoding="UTF-8"?>
<!--
To change this license header, choose License Headers in Project Properties.
To change this template file, choose Tools | Templates
and open the template in the editor.
-->


<Modelo
    xmlns:xsi='http://www.w3.org/2001/XMLSchema-instance'
    xsi:noNamespaceSchemaLocation='Modelo.xsd'>
    <curso>1</curso>
    <ciclo>DAW</ciclo>
    <nombreciclo>Desarollo de applicaciones web</nombreciclo>
    <codigopostal>49600</codigopostal>
    <comentario>Este ciclo es de DAW  </comentario>
    <temperatura>20</temperatura>
    <codigoasignatura>EDD</codigoasignatura>
    <profesor codP="ARN" mudolo="LMSGI">Amor Rodriguez</profesor>
  
</Modelo>
